{
 "date": "2026-07-20",
 "dyncap": {
  "value": 67406.03,
  "one_r": 1011.09,
  "method": "D-41 mark-to-market: allocated 75000.00 + realised(closed AEGIS) -3142.93 + unrealised(open, broker marks 2026-07-21T00:50:00Z) -4451.04 = 67406.03. AEGIS book only (RB:identity.capital_segregation)."
 },
 "open_positions": [
  {
   "ticker": "AMPL",
   "qty": 571,
   "entry": 9.7494,
   "entry_date": "",
   "stop_reference": 8.9,
   "stop_live_broker": 8.9,
   "stop_match": "MATCH",
   "tp1": null,
   "tp2": null,
   "tp3": null,
   "trigger": null,
   "broker": "TIGER",
   "unrealised_usd": -33.91
  },
  {
   "ticker": "DDOG",
   "qty": 24,
   "entry": 266.5438,
   "entry_date": "",
   "stop_reference": 247.17,
   "stop_live_broker": 248.3,
   "stop_match": "MISMATCH",
   "tp1": null,
   "tp2": null,
   "tp3": null,
   "trigger": null,
   "broker": "TIGER",
   "unrealised_usd": -61.05
  },
  {
   "ticker": "V",
   "qty": 20,
   "entry": 361.4496,
   "entry_date": "2026-07-16",
   "stop_reference": 343.29,
   "stop_live_broker": 343.29,
   "stop_match": "MATCH",
   "tp1": null,
   "tp2": null,
   "tp3": null,
   "trigger": null,
   "broker": "TIGER",
   "unrealised_usd": -15.39
  },
  {
   "ticker": "SPGI",
   "qty": 23,
   "entry": 450.3614,
   "entry_date": "2026-07-16",
   "stop_reference": 420.73,
   "stop_live_broker": 420.73,
   "stop_match": "MATCH",
   "tp1": null,
   "tp2": null,
   "tp3": null,
   "trigger": null,
   "broker": "TIGER",
   "unrealised_usd": -46.26
  },
  {
   "ticker": "IBM",
   "qty": 111,
   "entry": 263.14849,
   "entry_date": "",
   "stop_reference": null,
   "stop_live_broker": null,
   "stop_match": "MISSING",
   "tp1": null,
   "tp2": null,
   "tp3": null,
   "trigger": null,
   "broker": "IBKR",
   "unrealised_usd": -5522.08
  },
  {
   "ticker": "PTRN",
   "qty": 327,
   "entry": 25.15262,
   "entry_date": "",
   "stop_reference": 26.29,
   "stop_live_broker": null,
   "stop_match": "MISSING",
   "tp1": null,
   "tp2": null,
   "tp3": null,
   "trigger": null,
   "broker": "IBKR",
   "unrealised_usd": 842.8
  },
  {
   "ticker": "EXEL",
   "qty": 95,
   "entry": 54.73871,
   "entry_date": "",
   "stop_reference": 51.15,
   "stop_live_broker": null,
   "stop_match": "MISSING",
   "tp1": null,
   "tp2": null,
   "tp3": null,
   "trigger": null,
   "broker": "IBKR",
   "unrealised_usd": 109.37
  },
  {
   "ticker": "VRSK",
   "qty": 67,
   "entry": 191.8045,
   "entry_date": "",
   "stop_reference": 183.4,
   "stop_live_broker": null,
   "stop_match": "MISSING",
   "tp1": null,
   "tp2": null,
   "tp3": null,
   "trigger": null,
   "broker": "IBKR",
   "unrealised_usd": 669.03
  },
  {
   "ticker": "CHYM",
   "qty": 479,
   "entry": 21.15262,
   "entry_date": "",
   "stop_reference": 19.86,
   "stop_live_broker": null,
   "stop_match": "MISSING",
   "tp1": null,
   "tp2": null,
   "tp3": null,
   "trigger": null,
   "broker": "IBKR",
   "unrealised_usd": 372.36
  },
  {
   "ticker": "NTAP",
   "qty": 112,
   "entry": 172.15262,
   "entry_date": "",
   "stop_reference": 159.3,
   "stop_live_broker": null,
   "stop_match": "MISSING",
   "tp1": null,
   "tp2": null,
   "tp3": null,
   "trigger": null,
   "broker": "IBKR",
   "unrealised_usd": -1249.09
  },
  {
   "ticker": "NU",
   "qty": 871,
   "entry": 13.85055,
   "entry_date": "",
   "stop_reference": 13.02,
   "stop_live_broker": null,
   "stop_match": "MISSING",
   "tp1": null,
   "tp2": null,
   "tp3": null,
   "trigger": null,
   "broker": "IBKR",
   "unrealised_usd": 138.88
  },
  {
   "ticker": "SLDE",
   "qty": 629,
   "entry": 20.90262,
   "entry_date": "",
   "stop_reference": 20.45,
   "stop_live_broker": null,
   "stop_match": "MISSING",
   "tp1": null,
   "tp2": null,
   "tp3": null,
   "trigger": null,
   "broker": "IBKR",
   "unrealised_usd": 344.3
  }
 ],
 "closed_trades": [],
 "hedge": {
  "XLK_put_spread_aug21": {
   "legs": "+2x 175P / -2x 165P",
   "unreal_usd": 112.3
  },
  "XLF_put_spread_aug21": {
   "legs": "+6x 54P / -6x 51P",
   "unreal_usd": 13.92
  },
  "note": "Aegis hedges per plan 07-20 reconciliation (Aug-21 spreads, Tiger). Hedge MTM EXCLUDED from dynCap (consistent with D-41 series to date: stock book only). DISCREPANCY FLAG: an IWM Aug-07 put spread (+3x 288P / -3x 276P) IS live at IBKR although plan 07-20 said 'No IWM live' \u2014 surfaced, not resolved. QQQ/TLT put structures on IBKR book remain unreconciled into hedges (standing PM item)."
 },
 "metrics": {
  "gross_exposure_usd": 135210.46,
  "gross_leverage_x": 2.006,
  "unrealised_usd": -4451.04,
  "realised_today_usd": 0.0,
  "session_note": "No AEGIS fills 2026-07-20 (both brokers pulled; Tiger position qtys unchanged vs PTJ v2.9.6; approved optional XLK/XLF trims NOT exercised by PM). Non-Aegis option fills 15:09-15:21 UTC (NVDA/COIN/MARA/BE) excluded \u2014 Income Wheel/Protege9 book."
 },
 "broker_sync": {
  "last_sync_utc": "2026-07-21T00:50:00Z",
  "sync_phase": "POST_MARKET",
  "connectors": [
   "TIGER_MCPv7",
   "IBKR_NATIVE_CLAUDE_v1"
  ],
  "sources": "FULL \u2014 both brokers pulled live this run (IBKR recovered vs 07-20 intraday outage)",
  "aegis_positions_matched": 12,
  "aegis_positions_unmatched": 0,
  "fills_reconciled": 0,
  "fills_unmatched": 0,
  "non_aegis_fills_excluded": 4,
  "sl_audit_summary": {
   "MATCH": 3,
   "MISMATCH": 1,
   "MISSING": 8
  },
  "sl_audit_notes": "DDOG MISMATCH: live Tiger stop 248.30 vs reference 247.17 (+1.13, tighter \u2014 looks like a PM manual tighten; surfaced for confirmation, not resolved). 8 IBKR names MISSING an executable stop under the 30-day compliance hold \u2014 advisory references only; IBM carries no reference at all."
 }
}