{
 "date": "2026-07-21",
 "dyncap": {
  "value": 66335.47,
  "one_r": 995.03,
  "method": "D-41 mark-to-market: allocated 75000.00 + realised(closed AEGIS) -3142.93 + unrealised(open, live broker marks 07-21 close, recovered 2026-07-21) -5521.60 = 66335.47. AEGIS book only (RB:identity.capital_segregation)."
 },
 "open_positions": [
  {
   "ticker": "AMPL",
   "qty": 571,
   "entry": 9.7494,
   "entry_date": "",
   "stop_reference": 8.9,
   "stop_live_broker": 8.9,
   "stop_match": "MATCH",
   "tp1": null,
   "tp2": null,
   "tp3": null,
   "trigger": null,
   "broker": "TIGER",
   "unrealised_usd": -5.36,
   "mark": 9.74,
   "market_price": 9.74,
   "market_value_usd": 5561.54
  },
  {
   "ticker": "DDOG",
   "qty": 24,
   "entry": 266.5438,
   "entry_date": "",
   "stop_reference": 247.17,
   "stop_live_broker": 248.3,
   "stop_match": "MISMATCH",
   "tp1": null,
   "tp2": null,
   "tp3": null,
   "trigger": null,
   "broker": "TIGER",
   "unrealised_usd": -317.85,
   "mark": 253.3,
   "market_price": 253.3,
   "market_value_usd": 6079.2
  },
  {
   "ticker": "V",
   "qty": 20,
   "entry": 361.4496,
   "entry_date": "2026-07-16",
   "stop_reference": 343.29,
   "stop_live_broker": 343.29,
   "stop_match": "MATCH",
   "tp1": null,
   "tp2": null,
   "tp3": null,
   "trigger": null,
   "broker": "TIGER",
   "unrealised_usd": -101.19,
   "mark": 356.39,
   "market_price": 356.39,
   "market_value_usd": 7127.8
  },
  {
   "ticker": "SPGI",
   "qty": 23,
   "entry": 450.3614,
   "entry_date": "2026-07-16",
   "stop_reference": 420.73,
   "stop_live_broker": 420.73,
   "stop_match": "MATCH",
   "tp1": null,
   "tp2": null,
   "tp3": null,
   "trigger": null,
   "broker": "TIGER",
   "unrealised_usd": -438.87,
   "mark": 431.28,
   "market_price": 431.28,
   "market_value_usd": 9919.44
  },
  {
   "ticker": "IBM",
   "qty": 111,
   "entry": 263.14849,
   "entry_date": "",
   "stop_reference": null,
   "stop_live_broker": null,
   "stop_match": "MISSING",
   "tp1": null,
   "tp2": null,
   "tp3": null,
   "trigger": null,
   "broker": "IBKR",
   "unrealised_usd": -5769.61,
   "mark": 211.17,
   "market_price": 211.17,
   "market_value_usd": 23439.87
  },
  {
   "ticker": "PTRN",
   "qty": 327,
   "entry": 25.15262,
   "entry_date": "",
   "stop_reference": 26.29,
   "stop_live_broker": null,
   "stop_match": "MISSING",
   "tp1": null,
   "tp2": null,
   "tp3": null,
   "trigger": null,
   "broker": "IBKR",
   "unrealised_usd": 358.84,
   "mark": 26.25,
   "market_price": 26.25,
   "market_value_usd": 8583.75
  },
  {
   "ticker": "EXEL",
   "qty": 95,
   "entry": 54.73871,
   "entry_date": "",
   "stop_reference": 51.15,
   "stop_live_broker": null,
   "stop_match": "MISSING",
   "tp1": null,
   "tp2": null,
   "tp3": null,
   "trigger": null,
   "broker": "IBKR",
   "unrealised_usd": 131.22,
   "mark": 56.12,
   "market_price": 56.12,
   "market_value_usd": 5331.4
  },
  {
   "ticker": "VRSK",
   "qty": 67,
   "entry": 191.8045,
   "entry_date": "",
   "stop_reference": 183.4,
   "stop_live_broker": null,
   "stop_match": "MISSING",
   "tp1": null,
   "tp2": null,
   "tp3": null,
   "trigger": null,
   "broker": "IBKR",
   "unrealised_usd": 253.63,
   "mark": 195.59,
   "market_price": 195.59,
   "market_value_usd": 13104.53
  },
  {
   "ticker": "CHYM",
   "qty": 479,
   "entry": 21.15262,
   "entry_date": "",
   "stop_reference": 19.86,
   "stop_live_broker": null,
   "stop_match": "MISSING",
   "tp1": null,
   "tp2": null,
   "tp3": null,
   "trigger": null,
   "broker": "IBKR",
   "unrealised_usd": 578.33,
   "mark": 22.36,
   "market_price": 22.36,
   "market_value_usd": 10710.44
  },
  {
   "ticker": "NTAP",
   "qty": 112,
   "entry": 172.15262,
   "entry_date": "",
   "stop_reference": 159.3,
   "stop_live_broker": null,
   "stop_match": "MISSING",
   "tp1": null,
   "tp2": null,
   "tp3": null,
   "trigger": null,
   "broker": "IBKR",
   "unrealised_usd": -465.09,
   "mark": 168.0,
   "market_price": 168.0,
   "market_value_usd": 18816.0
  },
  {
   "ticker": "NU",
   "qty": 871,
   "entry": 13.85055,
   "entry_date": "",
   "stop_reference": 13.02,
   "stop_live_broker": null,
   "stop_match": "MISSING",
   "tp1": null,
   "tp2": null,
   "tp3": null,
   "trigger": null,
   "broker": "IBKR",
   "unrealised_usd": 469.86,
   "mark": 14.39,
   "market_price": 14.39,
   "market_value_usd": 12533.69
  },
  {
   "ticker": "SLDE",
   "qty": 629,
   "entry": 20.90262,
   "entry_date": "",
   "stop_reference": 20.45,
   "stop_live_broker": null,
   "stop_match": "MISSING",
   "tp1": null,
   "tp2": null,
   "tp3": null,
   "trigger": null,
   "broker": "IBKR",
   "unrealised_usd": -215.51,
   "mark": 20.56,
   "market_price": 20.56,
   "market_value_usd": 12932.24
  }
 ],
 "closed_trades": [],
 "hedge": {
  "XLK_put_spread_aug21": {
   "legs": "+2x 175P / -2x 165P",
   "unreal_usd": -88.7
  },
  "XLF_put_spread_aug21": {
   "legs": "+6x 54P / -6x 51P",
   "unreal_usd": -28.08
  },
  "note": "Aegis hedges = Tiger XLK put-spread + XLF put-spread only (D-71). Net unreal -116.78 (XLK -88.70 + XLF -28.08), live 07-21 close. IWM/QQQ/TLT and all single-name options are Protege9, excluded.",
  "aegis_net_unreal_usd": -116.78
 },
 "metrics": {
  "gross_exposure_usd": 134139.9,
  "gross_leverage_x": 2.022,
  "total_unrealised_usd": -5521.6,
  "open_positions": 12,
  "note": "recovered post-market 2026-07-21 (manual /recover). Gross 134140 / dynCap 66335 = 2.022x. No new fills this cycle (07-21 plan stayed DRAFT \u2014 book static)."
 },
 "broker_sync": {
  "asof_utc": "2026-07-22T01:42:07Z",
  "source": "manual /recover post-market \u2014 live re-pull IBKR + Tiger",
  "ibkr_aegis_stocks": 8,
  "tiger_aegis_stocks": 4,
  "aegis_hedge_legs": 4,
  "note": "12 Aegis stock positions re-marked to 07-21 close; XLK/XLF hedges re-marked; Protege9 positions excluded (D-71)."
 }
}